Goal,Rubric,Reference solution,article_id,q_id,Subdomain,Category,Identifier
"You are tasked with designing a convalescent hospital for women who have served overseas during wartime and are now recovering from various medical and surgical conditions. The hospital needs to provide a supportive environment that aids in their recovery, considering both their physical health and emotional well-being. The facility should be able to accommodate patients with different levels of mobility and medical needs, ranging from those requiring bed rest to those who are convalescing and can move around. The hospital is located in a repurposed house with gardens and trees, but within earshot of tramways. Develop a plan to create a peaceful and welcoming environment that promotes recovery and comfort for these patients, taking into account the existing infrastructure and resources available.","['The plan includes a detailed assessment of the existing infrastructure and how it can be adapted to meet the needs of the patients.'
 'The plan considers the impact of the external environment (e.g., noise from tramways) on the patients and proposes measures to mitigate any negative effects.'
 'The proposed environment incorporates elements known to promote healing and comfort, such as natural light, gardens, and recreational spaces.'
 'The plan differentiates between the needs of patients with varying levels of mobility and medical conditions.'
 'The plan includes strategies for creating a homelike atmosphere, such as the use of pleasant living areas and personal touches.'
 'The plan includes provisions for patient privacy and dignity.'
 'The plan outlines how the hospital can offer activities or therapies that promote mental and emotional well-being.'
 'The plan considers the potential for isolation or separation from family and friends and proposes ways to mitigate this.'
 'The plan demonstrates an understanding of the psychological impact of the hospital environment on patients recovering from wartime service.'
 'The plan is flexible and adaptable to changing circumstances, such as an influx of new patients or changes in patient needs.']","To create a convalescent hospital for women who have served overseas during wartime, we will utilize a repurposed house with gardens and trees at Isleworth. The hospital will cater to patients with various medical and surgical conditions, providing a supportive environment that addresses both physical health and emotional well-being.

First, we assess the existing infrastructure to determine how it can be adapted to meet patient needs. The house, originally built by Mr. Pears, has pleasant rooms, gardens, and fine old trees. Although it is within earshot of tramways, the tramways are not within sight, minimizing visual disturbance. The house has been adapted to accommodate wards of varying sizes, with smaller wards having three beds and larger ones accommodating more patients according to their size.

To promote healing and comfort, we incorporate elements known to be beneficial. The hospital utilizes natural light and pleasant vistas of trees and flowers through wide windows and doors opening onto the terrace. Patients are distributed according to their medical needs, with more serious cases on the ground floor in large, gracious rooms. Less serious medical cases are placed in top rooms, where they can benefit from a healthier environment, as evidenced by the healthier cheeks and brighter hair-ribbons of the patients.

The hospital differentiates between the needs of patients with varying levels of mobility and medical conditions. Patients requiring bed rest are accommodated in ground-floor wards, while those who are convalescing and can move around are placed in upper wards. The facility includes an operating theatre and a dispensary, ensuring that medical needs are met. A charming winter garden and a courtyard with a fountain provide recreational spaces for convalescent patients.

To create a homelike atmosphere, the hospital incorporates pleasant living areas and personal touches. The staff quarters are located in the garage stable annexe, providing commodious and homelike accommodations. The basement contains dining rooms for the staff and kitchens, ensuring that they are well-supported.

The hospital addresses patient privacy and dignity by having smaller wards and providing areas for isolation when necessary. An isolation ward is available off the winter garden, allowing for the separation of patients who require it.

To promote mental and emotional well-being, the hospital offers activities and therapies. A gramophone provided by the Queen is available in the courtyard for convalescent patients to enjoy while sewing or reading. Offers of occasional loans of motor-cars are appreciated to give patients a change of scenery, which is particularly beneficial for those undergoing long convalescence.

The staffing needs are met with a permanent staff of three doctors and fifty-seven W.A.A.C.s. The staff is supported through comfortable living quarters and adequate facilities.

To maintain a clean and hygienic environment, the hospital utilizes its existing infrastructure. The operating theatre and dispensary are equipped to handle medical needs, and the staff is trained to maintain cleanliness.

The hospital's environment is evaluated based on patient recovery and comfort. The distribution of patients according to their needs and the provision of recreational activities contribute to a peaceful and welcoming atmosphere.

The plan is realistic in terms of available resources. The hospital has adapted the existing house and gardens, utilizing the available space to create a supportive environment. The staffing needs are met, and the hospital has received donations, such as the gramophone from the Queen.

The psychological impact of the hospital environment on patients recovering from wartime service is considered. The hospital provides a peaceful and welcoming atmosphere, with pleasant surroundings and recreational activities, to mitigate the stress and hardship experienced by the patients.

The plan is flexible and adaptable to changing circumstances. The hospital has isolation wards and can adjust patient distribution according to changing needs.

By utilizing the existing infrastructure, incorporating elements known to promote healing and comfort, and addressing the varied needs of patients, the hospital provides a supportive environment for women recovering from wartime service.",5867127c3d55d125,ea2cffcb514ebef1,,,29832115
"You have developed a Massive Open Online Course (MOOC) to educate healthcare professionals about genomic variant interpretation. However, you notice that non-genomics clinicians are struggling with the course material, reporting it as ""too complex"" and showing higher attrition rates compared to genomics specialists. Your task is to devise a plan to adapt the MOOC to better meet the needs of non-genomics clinicians, ensuring that the revised course is effective and engaging for this group.","['The plan involves revising the MOOC content to simplify complex concepts and make it more accessible to non-genomics clinicians.'
 'A blended learning approach is considered, incorporating elements such as mentor-led models or face-to-face tutorials.'
 'The plan includes a strategy to increase learner interaction and engagement, such as discussion forums or live sessions.'
 'The revised MOOC is designed to be flexible and adaptable to the varying levels of genomics knowledge among non-genomics clinicians.'
 'The plan involves piloting the revised MOOC with a small group of non-genomics clinicians to gather feedback.'
 'The evaluation of the revised MOOC includes metrics to assess learner satisfaction, confidence, and knowledge gained.'
 'The plan considers the use of real-world clinical cases and worked examples to enhance learning.'
 'The evaluation of the revised MOOC considers the attrition rates and reasons for dropout among non-genomics clinicians.'
 'The plan involves collaboration with experts in genomics education and non-genomics clinicians to inform the revision process.'
 'The plan includes a strategy to assess the long-term impact of the revised MOOC on the practice of non-genomics clinicians.']","To address the scenario, we will revise the existing MOOC on genomic variant interpretation to better meet the needs of non-genomics clinicians. The revised MOOC will be designed to be more effective and engaging for this group.

First, we will conduct a needs assessment to identify the specific educational needs of non-genomics clinicians. This will involve gathering feedback from the previous evaluation cohort, including the free text answers and survey responses. We will also analyze the data on attrition rates and reasons for dropout among non-genomics clinicians to understand the challenges they faced.

The needs assessment will inform the revision of the MOOC content to simplify complex concepts and make it more accessible to non-genomics clinicians. We will use a collaborative approach, working with experts in genomics education and non-genomics clinicians to inform the revision process. The revised content will be designed to be flexible and adaptable to the varying levels of genomics knowledge among non-genomics clinicians.

To increase learner interaction and engagement, we will consider incorporating elements such as discussion forums or live sessions into the MOOC. A blended learning approach will also be explored, potentially incorporating mentor-led models or face-to-face tutorials. This will provide opportunities for non-genomics clinicians to apply their knowledge and receive feedback.

The revised MOOC will be designed to be regularly updated to reflect the latest best practice guidelines in genomic variant interpretation. We will use real-world clinical cases and worked examples to enhance learning and make the content more relevant to non-genomics clinicians.

To evaluate the revised MOOC, we will pilot it with a small group of non-genomics clinicians to gather feedback. The evaluation will include metrics to assess learner satisfaction, confidence, and knowledge gained. We will also monitor attrition rates and reasons for dropout among non-genomics clinicians.

The plan includes promoting the revised MOOC to non-genomics clinicians and encouraging their participation. We will use various channels to disseminate information about the MOOC, including professional email groups and social media.

To assess the long-term impact of the revised MOOC on the practice of non-genomics clinicians, we will conduct a follow-up evaluation. This will involve surveying participants at a later date to determine if they have applied the knowledge gained from the MOOC in their practice.

The evaluation of the revised MOOC will also consider feedback from learners to identify areas for further improvement. We will use this feedback to inform future updates to the MOOC and ensure that it remains effective and engaging for non-genomics clinicians.

By following this plan, we aim to create a revised MOOC that is tailored to the needs of non-genomics clinicians and provides them with the knowledge and skills they need to effectively interpret genomic variants.

The revised MOOC will be accessible and user-friendly, with clear navigation and minimal technical issues. We will ensure that the MOOC is designed to be flexible and can be completed at the learner's own pace.

Overall, our plan is to revise the MOOC to better meet the needs of non-genomics clinicians, pilot the revised MOOC, and evaluate its effectiveness. We will use a collaborative approach and gather feedback from learners to inform future updates and improvements.",332bda4a009bd7ce,a1bbada092446b25,,,37507729
"You are a researcher tasked with investigating the potential of oil palm and rubber plantations as grazing areas for sheep in Indonesia. The country's sheep population is significant, with 15.6 million head, and there's a need to identify new areas for sheep development to meet the demand for mutton and live animals. Your goal is to assess whether Garut sheep, a local breed known for its prolificacy, can adapt well to grazing in these plantations. You need to design a study to evaluate the physiological responses of Garut sheep to the humid tropical conditions found in oil palm and rubber plantations and determine if these environments can support sheep grazing without compromising the main plantation business. How would you approach this research problem?","['The proposed study should clearly state its objective to assess the adaptability of Garut sheep in oil palm and rubber plantations.'
 'The study design should include an evaluation of the physiological responses of Garut sheep to the humid tropical conditions.'
 'The research plan should consider the age and sex of the sheep as factors influencing physiological responses.'
 'The study should measure rectal temperature, heart rate, and respiratory rate as indicators of heat stress.'
 'The research should be conducted in a real-world setting, such as existing oil palm and rubber plantations.'
 'The study should account for the microclimate under the plantation trees and its effect on sheep.'
 'The research plan should include an assessment of the forage composition under the plantations.'
 'The proposed study should discuss the potential carrying capacity of these plantations for sheep grazing.'
 'The research should consider the management practices of the plantations and their impact on sheep grazing.'
 'The research plan should include a comparison between oil palm and rubber plantations in terms of their suitability for sheep grazing.']","To assess the adaptability of Garut sheep in oil palm and rubber plantations, we will conduct a comprehensive study that includes evaluating the physiological responses of the sheep to the humid tropical conditions found in these plantations. The study will be carried out in existing oil palm and rubber plantations in the Garut district, West Java, Indonesia.

First, we will survey the study sites to identify the types of forage available under the oil palm and rubber plantations. We will use the quadrat method to sample plant species within the plantations and measure the biomass of forage available. This will involve establishing 13 plots in each plantation, using randomly placed 1 m × 1 m quadrants, and cutting, weighing, and collecting the vegetation within each quadrant.

Next, we will assess the morphometric characteristics of 98 Garut sheep of different ages (1-5 years) using an electronic scale, measuring stick, and measuring tape. We will measure body weight and 12 body sizes, including wither height, rump height, and chest girth. We will also compute morphometric indices, such as the index of body frame and index of thoracic development, to evaluate the body proportions and breed type of the sheep.

To evaluate the physiological responses of the sheep, we will measure rectal temperature, heart rate, and respiratory rate in 24 sheep of various ages. We will also calculate the heat tolerance coefficient using the Benezra equation and the temperature-humidity index to gauge the degree of heat stress caused by the climate.

We will collect fecal samples from 59 sheep to identify and quantify internal parasites, including gastrointestinal nematodes and coccidiosis. We will use the McMaster counting chamber to count the number of eggs per gram of feces.

To investigate the genetic adaptation of Garut sheep to heat stress, we will collect blood samples from 31 sheep and amplify the heat shock protein 70 (HSP70) and interleukin 2 (IL2) genes using polymerase chain reaction (PCR). We will then sequence the PCR products to identify any polymorphisms.

The data collected will be analyzed using a general linear model to determine the effects of age, sex, and other factors on the physiological responses and morphometric characteristics of the sheep. We will also compare the forage composition and biomass under oil palm and rubber plantations.

The study will provide insights into the adaptability of Garut sheep to grazing in oil palm and rubber plantations and the potential carrying capacity of these plantations for sheep grazing. The findings will inform the development of sustainable land management practices that integrate sheep grazing into plantation systems, potentially increasing national sheep production without compromising the main plantation business.

Further research will be needed to fully understand the consumption of forages in these plantations and to develop guidelines for grazing management that accommodate the management of the main crops. The study's results will also inform the development of business units that can be developed in oil palm-livestock integration or rubber livestock integration systems, such as producing feeder lambs and fattening.

By shading the sheep from direct sunlight, the microclimate under the plantation trees will minimize the sheep's exposure to heat stress. The study will compare the suitability of oil palm and rubber plantations for sheep grazing and evaluate the impact of grazing on the main plantation business.

Overall, this study will provide a comprehensive understanding of the potential benefits and challenges of integrating sheep grazing into oil palm and rubber plantations in Indonesia.",9675d20e13ea193c,adc525b11bc09a5f,,,39328434
"You are studying the biogenesis of photosystem I (PSI) in plants and have isolated a PSI assembly intermediate from greening oat seedlings. Your goal is to understand the role of specific subunits in the assembly and function of PSI. You have determined the structure of the assembly intermediate using cryo-EM and have identified that it lacks several subunits, including PsaF and LHCI. You want to elucidate the regulatory mechanism that controls the assembly of LHCI with the PSI core. What steps would you take to investigate the role of PsaF in this process, and how would you test its significance in the biogenesis pathway?","['The research plan involves comparing the structure of the PSI assembly intermediate with and without PsaF.'
 'The proposal suggests using biochemical assays to assess the functional impact of PsaF absence on LHCI assembly.'
 'The plan includes analyzing protein-protein interactions to understand how PsaF promotes LHCI binding.'
 'The proposal involves examining the kinetic properties of the PSI assembly intermediate lacking PsaF.'
 'The plan includes controls to rule out degradation or artifacts in the assembly intermediate preparation.'
 'The researcher suggests comparing the findings with existing literature on PsaF-deficient mutants.'
 'The proposal includes a strategy to validate the findings using complementary techniques (e.g., biochemical, biophysical).'
 'The plan demonstrates an understanding of the PSI biogenesis pathway and its complexity.'
 'The researcher acknowledges potential limitations and confounders in the study.'
 'The proposal outlines a clear path for testing the significance of PsaF in PSI biogenesis.']","To investigate the role of PsaF in the assembly and function of photosystem I (PSI) and its significance in the biogenesis pathway, we will follow a multi-step research plan.

First, we will isolate PSI assembly intermediates from greening oat seedlings using a sucrose gradient centrifugation method, as previously described. We will then compare the structure of the isolated PSI assembly intermediate (pre-PSI-1) with the mature PSI using cryo-electron microscopy (cryo-EM). The pre-PSI-1 lacks several subunits, including PsaF and LHCI, which will allow us to understand the role of PsaF in the assembly process.

To elucidate the structural role of PsaF, we will analyze the protein-protein interaction map of pre-PSI-1 and mature PSI. This will help us understand how PsaF interacts with other subunits, particularly Lhca4 and PsaJ, and how it promotes the association of LHCI. We will use tools like PDBePISA v.1.52 to calculate the solvent-accessible interface area buried between subunits.

Next, we will assess the functional impact of PsaF absence on LHCI assembly and PSI function. We will measure the light-induced P700 photo-oxidation and P700+ reduction by plastocyanin (Pc) in both pre-PSI-1 and mature PSI. This will help us understand how the absence of PsaF affects the electron transfer rate and the overall functionality of PSI. We will also perform NADP+ photoreduction activity assays to evaluate the photoreduction activity of pre-PSI-1 and mature PSI.

To further investigate the effect of PsaF on thylakoid organization, we will examine the presence of PsaF in thylakoid membranes during greening using SDS-PAGE and immunoblotting. We will also compare our findings with existing literature on PsaF-deficient mutants to understand the universal mechanism of PsaF in PSI biogenesis.

To rule out degradation or artifacts in the pre-PSI-1 preparation, we will perform controls such as comparing the pre-PSI-1 with mature PSI purified from the same plant material and verifying the absence of free PsaF in the thylakoid membrane.

Finally, we will validate our findings using complementary techniques such as biochemical and biophysical assays. We will analyze the structural alterations in the pre-PSI-1 and compare them with the mature PSI to understand the regulatory mechanisms controlling PSI assembly.

By following this research plan, we aim to elucidate the role of PsaF as a regulatory checkpoint that promotes the assembly of LHCI and couples biogenesis to function, effectively controlling the PSI biogenesis pathway.",4cc3ad218b046aa3,d536f59e385fcb53,,,38816499
