Goal,Rubric,Reference solution,article_id,q_id,Subdomain,Category,Identifier
"You are a researcher investigating the relationship between antipsychotic drug (APD) treatment and cardiovascular risk in schizophrenia patients. You have collected data on the aortic calcification index, a known predictor of cardiovascular risk, and APD equivalent doses for a cohort of 56 schizophrenia patients. Your goal is to explore the relationship between APD treatment and aortic calcification. However, upon analyzing the data, you observe a counterintuitive negative association between APD equivalent dose and aortic calcification index. Design a research plan to understand this unexpected finding, considering potential confounding factors and the complexities of APD treatment.","['The plan includes a thorough review of existing literature on APD treatment and cardiovascular risk to contextualize the finding.'
 'The plan considers potential confounding factors such as age, sex, smoking status, and comorbidities.'
 'The plan involves statistical analysis to control for confounding variables and assess the robustness of the observed association.'
 'The plan includes an examination of the distribution of APD types and doses among the patient cohort.'
 'The plan considers the potential impact of APD treatment duration on the observed association.'
 'The plan includes an assessment of the potential mechanisms underlying the observed negative association.'
 'The plan involves evaluating the clinical implications of the finding for APD treatment strategies.'
 ""The plan includes a discussion of the study's limitations, including sample size and potential biases.""
 'The plan considers the need for further research, such as cohort studies or randomized controlled trials.'
 'The plan involves assessing the generalizability of the findings to other populations.']","To address the counterintuitive finding of a negative association between antipsychotic drug (APD) equivalent dose and aortic calcification index in schizophrenia patients, we will undertake a comprehensive research plan.

First, we will conduct a thorough review of existing literature on APD treatment and cardiovascular risk to contextualize our finding. This will involve examining studies that have investigated the relationship between APD treatment and cardiovascular outcomes, including aortic calcification. We will also review the pharmacological properties of different APDs, including olanzapine, to understand their potential effects on cardiovascular risk.

Next, we will perform a detailed analysis of the data collected from the 56 schizophrenia patients. We will compare the clinical characteristics of patients with high and low aortic calcification indices, including age, sex, smoking status, and comorbidities such as hypertension, diabetes mellitus, and coronary artery disease. This will help identify potential confounding factors that may be contributing to the observed association.

We will then conduct statistical analysis to control for these confounding variables and assess the robustness of the observed association. This will involve using multiple regression analysis to examine the relationship between APD equivalent dose and aortic calcification index while adjusting for age, sex, smoking status, and other relevant factors. We will also examine the distribution of APD types and doses among the patient cohort to determine if there are any differences in treatment regimens between patients with high and low aortic calcification indices.

Furthermore, we will investigate the potential impact of APD treatment duration on the observed association. We will analyze the duration of APD treatment in patients with high and low aortic calcification indices to determine if there are any differences in treatment duration that may be contributing to the observed association.

To better understand the role of specific APDs, such as olanzapine, in the observed association, we will compare the characteristics of patients treated with different APDs. We will examine the equivalent doses and treatment durations of different APDs, as well as their associations with aortic calcification index.

We will also assess the potential mechanisms underlying the observed negative association between APD equivalent dose and aortic calcification index. This will involve examining the effects of APDs on cardiovascular risk factors, such as lipid and glucose metabolism, blood pressure, and cardiac function.

The clinical implications of our findings will be evaluated, including the potential impact on APD treatment strategies for schizophrenia patients. We will consider the potential benefits and risks of different APD treatment regimens and discuss the need for further research, such as cohort studies or randomized controlled that can provide more definitive evidence on the relationship between APD treatment and cardiovascular risk.

The limitations of our study, including the relatively small sample size and potential biases, will be acknowledged and discussed. We will also consider the generalizability of our findings to other populations and the potential impact of other medications or treatments on the observed association.

In conclusion, our research plan will involve a comprehensive analysis of the relationship between APD equivalent dose and aortic calcification index in schizophrenia patients, including a thorough review of existing literature, detailed analysis of clinical data, statistical analysis to control for confounding variables, and an assessment of the potential mechanisms and clinical implications of our findings.

We will ensure compliance with relevant regulations and consider the ethical implications of our research. Our plan is designed to provide a thorough understanding of the observed negative association between APD equivalent dose and aortic calcification index, and to inform the development of evidence-based treatment strategies for schizophrenia patients.

By following this plan, we aim to provide a comprehensive and nuanced understanding of the complex relationship between APD treatment and cardiovascular risk in schizophrenia patients.",84fa9688d5604fea,3aa6b016be598bbb,,,34568454
"Desulfovibrio vulgaris is known to corrode iron, but the mechanisms behind this process are not well understood. Previous studies have proposed multiple mechanisms, including direct electron transfer from iron to the microbe and electron transfer via hydrogen gas (H2) as an intermediary. You are tasked with designing an experiment to determine whether H2 is a primary intermediate in the corrosion process. The goal is to clarify the interpretation of previous D. vulgaris corrosion studies and understand the role of H2 in iron corrosion under sulfate-reducing conditions. You have access to a hydrogenase-deficient mutant strain of D. vulgaris and the wild-type parental strain. Describe an experimental approach to investigate the role of H2 in D. vulgaris corrosion of iron.","['The experimental approach includes comparing the ability of the hydrogenase-deficient mutant strain and the wild-type parental strain to reduce sulfate with Fe0 as the electron donor.'
 'The experiment involves measuring sulfate reduction and H2 concentrations over time in cultures with Fe0 as the sole electron donor.'
 'The experimental design includes controls without cells or without Fe0 to account for abiotic H2 generation.'
 'The experiment is conducted under anaerobic conditions to mimic the sulfate-reducing environment.'
 'The use of a hydrogenase-deficient mutant strain is justified as a means to evaluate the necessity of H2 uptake for sulfate reduction with Fe0.'
 'The experimental design allows for the assessment of whether H2 accumulates in the absence of hydrogenase activity.'
 'The approach includes monitoring H2 concentrations to determine if the parental strain consumes H2 produced from Fe0.'
 'The experiment is designed to test whether the inability to consume H2 affects the rate of sulfate reduction with Fe0.'
 'The experimental approach should be able to distinguish between H2-mediated electron transfer and other proposed mechanisms.'
 'The approach involves quantifying the amount of sulfate reduced and comparing it to the amount of H2 produced.']","To investigate the role of H2 in D. vulgaris corrosion of iron, we will compare the ability of a hydrogenase-deficient mutant strain and the wild-type parental strain to reduce sulfate with Fe0 as the electron donor. The experiment involves measuring sulfate reduction and H2 concentrations over time in cultures with Fe0 as the sole electron donor.

We will grow D. vulgaris strains JW710 (parental strain) and JW5095 (hydrogenase-deficient mutant) anaerobically at 37°C in a modification of the NBAF medium, designated NB medium, with Fe0 granules as the sole electron donor, 5 mM sulfate as the electron acceptor, and 5 mM sodium acetate as a carbon source. A 10% inoculum of a mid-log-phase culture of lactate-grown cells will serve as the inoculum. We will monitor growth by measuring culture turbidity, and we will measure sulfate loss and H2 concentrations over time.

To account for abiotic H2 generation, we will include controls without cells or without Fe0. We will also assess the potential impact of sulfide produced during sulfate reduction on H2 generation by adding sulfide to sterile Fe0-containing medium. Additionally, we will evaluate the possibility of extracellular hydrogenases released from moribund cells accelerating H2 production by incubating Fe0 with culture supernatants from D. vulgaris cultures grown with H2 or Fe0.

To further distinguish between H2-mediated electron transfer and other proposed mechanisms, such as direct electron transfer or electron shuttles, we will conduct studies with 316L stainless steel as the potential electron donor. Unlike pure Fe0, H2 production from stainless steel is minimal, and microbes capable of direct electron uptake from Fe0 can extract electrons from stainless steel to support anaerobic respiration.

We will also examine the possibility of electron shuttles facilitating electron transfer between Fe0 and D. vulgaris by adding riboflavin or anthraquinone-2,6-disulfonate (AQDS) to cultures with Fe0 as the sole electron donor. We will quantify the amount of sulfate reduced and compare it to the amount of H2 produced to determine if H2 is a primary intermediate in the corrosion process.

To visualize cell attachment to Fe0, we will use confocal scanning laser microscopy. Fe0 pieces will be gently removed from the culture, stained with a Live/Dead BacLight bacterial viability kit, and visualized with a 100× objective on a Nikon A1R-SIMe confocal microscope.

By using a hydrogenase-deficient mutant strain, we can evaluate the necessity of H2 uptake for sulfate reduction with Fe0. The experimental design allows for the assessment of whether H2 accumulates in the absence of hydrogenase activity and whether the parental strain consumes H2 produced from Fe0. The experiment is designed to test whether the inability to consume H2 affects the rate of sulfate reduction with Fe0, thus clarifying the role of H2 in D. vulgaris corrosion of iron.

The use of Fe0 as the sole electron donor and sulfate as the electron acceptor will support the growth of D. vulgaris under conditions relevant to sulfate-reducing environments. The experimental design takes into account potential confounding factors, such as carryover of lactate from the inoculum, and includes controls to account for abiotic H2 generation.

Overall, this experimental approach will provide a comprehensive understanding of the role of H2 in D. vulgaris corrosion of iron and will help to distinguish between H2-mediated electron transfer and other proposed mechanisms.",d383451748f1e56b,a548d0fa289a07af,,,36786581
"You have conducted a series of experiments on Daphnia magna to investigate the effects of maternal exposure to toxic cyanobacteria on offspring fitness. You now want to assess the generality of your findings by comparing them with other studies on Daphnia and cyanobacteria. How would you conduct a meta-analysis to evaluate the overall evidence for adaptive maternal effects in response to toxic cyanobacteria, and what factors would you consider when interpreting the results?","['The response proposes a systematic search strategy for identifying relevant studies on Daphnia and cyanobacteria.'
 'The response evaluates the criteria for selecting studies to be included in the meta-analysis (e.g., experimental design, traits measured).'
 'The response considers the need to extract relevant data from the selected studies (e.g., effect sizes, sample sizes).'
 'The response proposes a statistical model for the meta-analysis that accounts for between-study and within-study variation.'
 'The response discusses the importance of considering heterogeneity among studies (e.g., different species, experimental conditions).'
 'The response discusses the importance of evaluating the quality and reliability of the included studies.'
 'The response proposes examining the robustness of the findings to different analytical choices and assumptions.'
 'The response considers the implications of the meta-analysis findings for understanding the adaptive value of maternal effects.'
 'The response discusses the potential for the meta-analysis to identify gaps in the existing literature and areas for future research.'
 'The response acknowledges potential limitations of the meta-analysis and proposes ways to address them.']","To conduct a meta-analysis evaluating the overall evidence for adaptive maternal effects in response to toxic cyanobacteria in Daphnia, we will follow a systematic approach.

First, we will perform a comprehensive search for relevant studies. We will search Web of Science using the terms ""Daphnia AND Microcystin"" in titles, abstracts, and keywords. We will also conduct forward and backward searches of the citations of the identified papers to include additional relevant studies. This search will be performed on a specific date to ensure reproducibility.

We will include both published and unpublished studies in our meta-analysis to minimize publication bias. Studies will be selected based on their experimental design, specifically those that expose the maternal generation to Microcystis spp. or microcystin and the offspring to the same and a control treatment. We will extract data from studies that report traits related to fitness, such as replacement rates, ages of reproduction, brood sizes, survival estimates, and body size measurements.

For each selected study, we will extract statistics on the traits measured, including means and standard deviations (or standard errors). If a study reports survival estimates, we will convert the log odds ratio to Hedges' g. We will calculate Hedges' g for the effect of maternal exposure on offspring fitness when offspring are exposed to toxic cyanobacteria.

We will use a multi-level meta-analytic model to account for between-study and within-study variation. The model will include random effects for study, clone, and trait class (e.g., fitness estimate, offspring quantity measurement, age of reproduction measurement, survival estimate, or morphometric measurement). We will also investigate whether the concentration of microcystin used in the studies affects the strength of the maternal effects by including it as a moderator in the model.

To evaluate the quality and reliability of the included studies, we will examine the experimental designs and reported statistics. We will assess the robustness of our findings by checking the sensitivity of the results to different analytical choices and assumptions.

The meta-analysis will provide an overall estimate of the effect size of maternal exposure to toxic cyanobacteria on offspring fitness. We will interpret the results in the context of the research question, considering the implications for understanding the adaptive value of maternal effects in Daphnia.

By synthesizing the available evidence, we aim to identify gaps in the existing literature and areas for future research. Our findings will contribute to the broader context of ecological and evolutionary research on maternal effects and their role in shaping the fitness of organisms in stressful environments.

The results will be presented with consideration of potential limitations, such as heterogeneity among studies and potential publication bias. We will discuss the implications of our findings and propose avenues for future research to further elucidate the mechanisms and significance of maternal effects in Daphnia.

Our analysis will be performed using Stan, a Bayesian general-purpose C++ inference library, and the code will be made available. By following this systematic approach, we will provide a comprehensive evaluation of the evidence for adaptive maternal effects in response to toxic cyanobacteria in Daphnia.",40a4ec6724a02ae2,a525a7bfe6d4561d,,,30619577
"You are designing a clinical study to evaluate the safety and efficacy of using a ureteral access sheath (UAS) during flexible ureteroscopy (FURS) for renal stone treatment. Your goal is to minimize the risk of ureteral injury associated with UAS insertion. Describe a step-wise technique to decide whether to use a UAS and determine its size, ensuring the approach is safe and effective for patients with varying ureteral compliance.","['The proposed technique involves a preliminary step to assess ureteral compliance before UAS insertion.'
 'The technique includes the use of semi-rigid ureteroscopy prior to flexible ureteroscopy.'
 'The approach allows for calibration of the ureter to determine the appropriate size of UAS.'
 'The method avoids forced insertion of UAS based on the assessment of ureteral compliance.'
 'The technique is designed to reduce the risk of ureteral injury during UAS placement.'
 'The proposed approach is tailored to accommodate patients with varying ureteral compliance.'
 'The step-wise technique is grounded in clinical evidence or established urological practices.'
 'The method allows for flexibility in deciding whether to use a UAS based on individual patient anatomy.'
 'The proposed technique is designed to be feasible in a clinical setting with standard urological equipment.'
 'The step-wise technique is described in a clear, replicable manner.']","To minimize the risk of ureteral injury associated with ureteral access sheath (UAS) insertion during flexible ureteroscopy (FURS) for renal stone treatment, we propose a step-wise technique that assesses ureteral compliance before UAS insertion. This approach is grounded in the clinical evidence and established urological practices described in the provided document.

First, we perform rigid cystoscopy to visualize the bladder and ureteric orifice, followed by the introduction of a safety guidewire. Then, semi-rigid ureteroscopy is conducted over a working guidewire up to the pelvi-ureteric junction (PUJ) or as far proximally as safely achievable. This step allows for passive dilatation of the ureteric orifice and ureter, enabling us to calibrate the ureter and judge whether an access sheath can be safely inserted.

The semi-rigid ureteroscopy serves as a crucial preliminary step to assess ureteral compliance. By doing so, we can determine the appropriate size of UAS that can be accommodated by the ureter. If the ureter is deemed too tight for safe UAS insertion, we proceed with FURS over a safety wire without using a UAS. This approach avoids forced insertion of UAS, thereby reducing the risk of ureteral injury.

The decision to use a UAS is based on the assessment of ureteral compliance during semi-rigid ureteroscopy. If a UAS is deemed suitable, it is inserted over the working wire and positioned just distal to the PUJ under fluoroscopic guidance. The size of the UAS used depends on the ureteral compliance and patient anatomy.

We use a range of UAS sizes (9.5/11F, 12F/14F, or 14F/16F) and lengths (35 cm or 45 cm) based on patient demographics, such as gender and age. For instance, a 45 cm length UAS is typically used for males, while a 35 cm length is used for females and pediatric patients.

Throughout the procedure, we visually inspect the ureter during semi-rigid ureteroscopy to guide UAS placement and assess the ureter for any potential damage upon withdrawal of the FURS. This step-wise technique is designed to accommodate patients with varying ureteral compliance and minimize the risk of ureteral injury.

The use of this technique is part of a broader strategy to improve the safety profile of FURS. By tailoring the approach to individual patient anatomy and ureteral compliance, we can reduce the risk of complications associated with UAS insertion. This method is feasible in a clinical setting with standard urological equipment and does not rely on additional, unvalidated diagnostic tools or methods.

The proposed technique is designed to be clear and replicable, allowing for its widespread adoption in clinical practice. By following this step-wise approach, we can ensure that the use of UAS during FURS is both safe and effective for patients with renal stones, while minimizing the risk of ureteral injury.",f1213462aabbae1b,a865d4d7e7fff1b3,,,31342247
