Goal,Rubric,Reference solution,article_id,q_id,Subdomain,Category,Identifier
"You are a researcher aiming to improve the representation of Southeast Asian patients in prostate cancer clinical trials. The current trials are predominantly conducted in Western populations, with limited representation from Southeast Asia. Develop a research plan to address this issue and propose strategies to increase the inclusion of Southeast Asian patients in future clinical trials.","['The plan includes a review of existing literature on the differences in prostate cancer epidemiology and treatment outcomes between Western and Southeast Asian populations.'
 'The plan proposes a strategy to identify and engage with key stakeholders, including healthcare providers, patient advocacy groups, and policymakers, to improve the representation of Southeast Asian patients in clinical trials.'
 'The plan considers the cultural, socioeconomic, and linguistic diversity of Southeast Asia and its potential impact on patient recruitment and retention.'
 'The plan includes a strategy to develop culturally sensitive and linguistically appropriate patient education materials and informed consent forms.'
 'The plan includes a plan for collaboration with local healthcare authorities and CROs to support patient recruitment and data collection.'
 'The plan considers the potential barriers to accessing clinical trials in Southeast Asia, including cost, transportation, and healthcare infrastructure.'
 'The plan includes a plan for monitoring and addressing potential biases and confounding variables in clinical trials.'
 'The plan proposes a strategy to analyze the outcomes of Southeast Asian patients in clinical trials and compare them to other populations.'
 'The plan includes a plan for disseminating the findings to relevant stakeholders, including healthcare providers, policymakers, and patient advocacy groups.'
 'The plan considers the potential for the findings to inform healthcare policy and decision-making in Southeast Asia.']","To improve the representation of Southeast Asian patients in prostate cancer clinical trials, we need to understand the current landscape and identify the gaps in knowledge and practice. The provided document highlights the lack of clinical trials in Southeast Asia and the limitations of extrapolating findings from broader Asian sub-analyses to Southeast Asian patients.

First, we will conduct a comprehensive review of existing literature on prostate cancer epidemiology, treatment outcomes, and clinical trials in Southeast Asia. This review will include studies on the prevalence, incidence, and mortality rates of prostate cancer in Southeast Asia, as well as the current treatment practices and outcomes. We will also examine the differences in prostate cancer biology and treatment responses between Southeast Asian and Western populations.

Next, we will identify and engage with key stakeholders, including healthcare providers, patient advocacy groups, and policymakers, to understand their perspectives and needs. We will conduct surveys, interviews, and focus groups to gather information on the current challenges and barriers to conducting clinical trials in Southeast Asia. This will include assessing the availability of resources, infrastructure, and expertise in the region.

To address the cultural, socioeconomic, and linguistic diversity of Southeast Asia, we will develop culturally sensitive and linguistically appropriate patient education materials and informed consent forms. We will work with local healthcare authorities, patient advocacy groups, and community leaders to ensure that these materials are accurate, accessible, and effective.

We will also propose a strategy to improve patient awareness and understanding of clinical trials in Southeast Asia. This will involve collaborating with local healthcare providers, patient advocacy groups, and community organizations to educate patients about the benefits and risks of participating in clinical trials. We will also develop targeted outreach programs to reach underserved populations and communities.

To support patient recruitment and data collection, we will collaborate with local healthcare authorities and Clinical Research Organizations (CROs) in Southeast Asia. We will work with these partners to identify potential study sites, develop site-specific strategies for patient recruitment and retention, and provide training and support for site staff.

We recognize that there are potential barriers to accessing clinical trials in Southeast Asia, including cost, transportation, and healthcare infrastructure. To address these barriers, we will develop strategies to reduce costs, improve transportation options, and enhance healthcare infrastructure. This may include providing financial support or reimbursement to patients, partnering with transportation services, and upgrading healthcare facilities and equipment.

To monitor and address potential biases and confounding variables in clinical trials, we will implement robust data collection and monitoring procedures. We will also conduct regular analyses to identify potential biases and confounding variables and develop strategies to address them.

Our plan includes analyzing the outcomes of Southeast Asian patients in clinical trials and comparing them to other populations. We will conduct subgroup analyses to identify differences in treatment responses and outcomes between Southeast Asian and other populations. We will also examine the impact of cultural, socioeconomic, and linguistic factors on treatment outcomes.

Finally, we will disseminate our findings to relevant stakeholders, including healthcare providers, policymakers, and patient advocacy groups. We will publish our results in peer-reviewed journals and present them at international conferences. We will also work with local healthcare authorities and policymakers to inform healthcare policy and decision-making in Southeast Asia.

By following this plan, we aim to improve the representation of Southeast Asian patients in prostate cancer clinical trials and contribute to the development of more inclusive and effective clinical trials that address the needs of diverse patient populations.",b01acf8bedd0d07a,c93c775214817a32,,,36609251
You are tasked with understanding the temporal gene expression profile after LPS stimulation in an oligodendrocyte-microglia co-culture system. The goal is to identify potential protective mechanisms that could explain the observed tolerance effect of LPS pre-treatment against hyperoxia-induced oligodendrocyte damage. You need to design a study to investigate the changes in gene expression over time after LPS stimulation and to relate these changes to the observed protective effects.,"['The study investigates the temporal gene expression profile after LPS stimulation in a co-culture system.'
 'The research assesses the expression of pro-inflammatory cytokines (TNFα and IL-1β) at early and late time points after LPS stimulation.'
 'The study evaluates the expression of anti-inflammatory cytokines (IL-10) and reactive oxygen species scavengers (SOD2) at early and late time points after LPS stimulation.'
 'The research relates the observed changes in gene expression to the protective effects of LPS pre-treatment against hyperoxia-induced damage.'
 'The experiment considers the expression of transcription factors controlling oligodendrocyte development (Sox9 and Sox10) after LPS stimulation.'
 'The research evaluates the impact of LPS stimulation on the expression of oligodendrocyte maturation markers (CNP and MBP).'
 'The study identifies potential therapeutic targets based on the observed changes in gene expression.'
 'The experiment accounts for potential confounding variables such as the concentration of LPS and the duration of stimulation.'
 'The study discusses the implications of the findings for understanding the mechanisms of LPS-induced tolerance.'
 'The research considers the relevance of the in vitro findings to in vivo models of white matter damage.']","To investigate the temporal gene expression profile after LPS stimulation in an oligodendrocyte-microglia co-culture system and identify potential protective mechanisms against hyperoxia-induced oligodendrocyte damage, we will follow a detailed research plan.

First, we will establish primary oligodendrocyte-microglia co-cultures from the cerebral hemispheres of Sprague Dawley rats at P1 to P2 using a shaking method of mixed-glia-cultures. The OL-MG ratio will be set to 1:1 following cell count results in the rat brain. We will culture purified OL in 24- or 48-well plates with a density of 20,000 cells/cm2 for 3 days in a serum-free basal-defined medium before adding MG.

Next, we will stimulate the co-cultures with 1 µg/mL LPS for 24 h, followed by exposure to 80% oxygen for 8 h or maintenance under standard growth conditions. We will also perform a time-matched experiment where co-cultures are co-exposed to LPS and hyperoxia for 8 h. Supernatants will be collected for cytotoxicity assays using LDH release as a measure of cell death.

To analyze gene expression changes after LPS stimulation, we will isolate total cellular RNA at early (4 h) and late (24 h) time points using acidic phenol/chloroform extraction and DNase I treatment. We will then reverse transcribe 1 µg of RNA and quantify PCR products in real-time using dye-labeled fluorogenic reporter oligonucleotides. We will assess the expression of pro-inflammatory cytokines (TNFα and IL-1β), anti-inflammatory cytokines (IL-10), and reactive oxygen species scavengers (SOD2) at both time points. Additionally, we will evaluate the expression of transcription factors controlling oligodendrocyte development (Sox9 and Sox10) and oligodendrocyte maturation markers (CNP and MBP) after LPS stimulation.

We will perform quantitative Real-Time PCR analysis using the StepOnePlus Real-Time PCR System with a total reactive volume of 11 µl containing 5 µl of 2× KAPA PROBE FAST qPCR Mastermix, 2.5 µl of 2 µM oligonucleotide mix, 0.5 µM probe, and 20 ng of cDNA template. The PCR amplification will consist of 40 cycles with each cycle at 94°C for 15 sec and 60°C for 1 min. We will normalize target levels to HPRT levels and express data as fold change of control using the ΔΔCt method.

To relate the observed changes in gene expression to the protective effects of LPS pre-treatment against hyperoxia-induced damage, we will compare the gene expression profiles between LPS-stimulated co-cultures with and without hyperoxia exposure. We will also analyze the morphological changes in oligodendrocytes by counting the number of processes per cell.

The data will be presented as mean + SEM, and the significance of differences among groups will be determined by one-way ANOVA followed by post hoc independent sample t-test multiple comparisons. Adjusted P-values of <0.05 will be considered statistically significant.

By following this research plan, we aim to elucidate the temporal gene expression profile after LPS stimulation in oligodendrocyte-microglia co-cultures and identify potential protective mechanisms against hyperoxia-induced oligodendrocyte damage. The findings will provide insights into the mechanisms underlying LPS-induced tolerance and may inform the development of therapeutic strategies targeting white matter damage in premature infants.",c130e959043fef0e,cc7a9abc6c1fef6f,,,23155446
"You are a researcher studying the evolution of RNA-induced silencing complex (RISC) members. Your goal is to classify Argonaute (AGO) proteins, a key component of RISC, into functional categories based on their RNA-binding characteristics. You have obtained a dataset of AGO protein sequences from various animal species, including Chordata, Arthropoda, Nematoda, and Platyhelminthes. However, the sequences are highly diverse, and you need to develop a classification system that accurately reflects their functional roles. How would you approach this problem and what features would you use to classify AGO proteins?","['The classification system should be based on the RNA-binding characteristics or functions of AGOs.'
 'The approach should involve phylogenetic analysis of AGO protein sequences.'
 'The analysis should consider the domain structures of AGO proteins, including PAZ and PIWI domains.'
 'The approach should account for the evolutionary complexities of AGOs in different species.'
 'The classification system should be able to distinguish between different subclasses within the main classes.'
 'The classification system should be based on a clear understanding of the functional roles of different AGOs.'
 'The analysis should consider the potential for gene duplication events in AGO evolution.'
 'The classification system should be able to accommodate newly discovered AGO proteins.'
 'The approach should be transparent and reproducible, allowing for verification by other researchers.'
 'The classification system should provide insights into the evolutionary history of AGO proteins.']","To classify Argonaute (AGO) proteins into functional categories based on their RNA-binding characteristics, we will employ a comprehensive evolutionary analysis. This involves analyzing AGO protein sequences from various animal species, including Chordata, Arthropoda, Nematoda, and Platyhelminthes.

First, we retrieve AGO protein sequences from UniProt using key protein sequences as queries via the BLAST algorithm. We apply a homology cut-off of E-values ≤0.0001 to ensure reliable results. The retrieved sequences are then subjected to multiple sequence alignment using MUSCLE, with default settings for optimal accuracy and speed.

Next, we construct phylogenetic trees using the Neighbor-joining method in MEGA7, labeling the percentage of replicate trees evaluated by bootstrap test (1,000 replicates) next to the branches. This step is crucial for understanding the evolutionary relationships among AGO proteins and assessing the reliability of the phylogenetic tree.

We analyze the domain architecture of AGO proteins using SMART, which identifies, annotates, and analyzes protein domain structures. This is essential for understanding the functional roles of different AGOs, as their characteristic domains (PAZ, Mid, and PIWI) play critical roles in RNA binding and silencing.

Based on the phylogenetic analysis and domain structures, we classify AGO proteins into three main classes: multifunctional AGOs, siRNA-associated AGOs, and piRNA-associated AGOs. Multifunctional AGOs, such as chordate AGO1-4, associate with both siRNAs and miRNAs. siRNA-associated AGOs, including Arthropoda (Drosophila AGO2) and Nematoda AGOs, specifically bind to siRNAs. piRNA-associated AGOs, comprising chordate PIWIL1-4, Arthropoda AGO3/AUB/PIWI/SIWI, and Platyhelminthes PIWIL/PIWI1/PIWI2, bind to piRNAs and are primarily involved in germ-line functions.

To account for the evolutionary complexities of AGOs in different species, we consider the diverse range of animal species in our analysis. This includes examining the subclasses within the main classes, such as the subclasses of chordate AGOs (AGO2 and AGO1/3/4) and Arthropoda AGOs (AGO2 and AGO3/AUB/PIWI/SIWI).

Furthermore, we quantify gene duplication events in AGOs using the ""Find gene duplications"" module in MEGA7. This step is vital for understanding the evolutionary history of AGO proteins and how gene duplication has contributed to their functional diversification.

Our classification system is based on a clear understanding of the functional roles of different AGOs and their RNA-binding characteristics. By integrating phylogenetic analysis, domain structure analysis, and consideration of gene duplication events, we provide a comprehensive framework for classifying AGO proteins. This approach is transparent, reproducible, and capable of accommodating newly discovered AGO proteins, making it a valuable tool for understanding RISC evolution and optimizing species-specific RISCs.

The detailed analysis will be performed using the following steps:
1. Retrieve AGO protein sequences from UniProt.
2. Perform multiple sequence alignment using MUSCLE.
3. Construct phylogenetic trees using the Neighbor-joining method in MEGA7.
4. Analyze domain architecture using SMART.
5. Classify AGO proteins into multifunctional, siRNA-associated, and piRNA-associated AGOs based on phylogenetic analysis and domain structures.
6. Quantify gene duplication events using MEGA7.

By following this plan, we aim to develop a robust classification system for AGO proteins that reflects their functional roles and evolutionary history.",1517c8a5a0d3619a,4901513bef6bca35,,,30242207
"You are a researcher aiming to improve the accuracy of rumen models by integrating knowledge of the rumen microbiome. However, you face the challenge of linking the detailed information on microbial diversity and gene expression to the functional aspects of rumen fermentation represented in whole rumen models. How would you approach this problem, and what observations or data would you need to make to successfully integrate rumen microbiome data into a rumen model?","['The response acknowledges the gap between rumen microbiome data and whole rumen function modeling.'
 'The response discusses the need to observe important drivers of whole rumen function.'
 'The observations include measurements of rumen volume, outflow, substrate degradation, VFA profiles, and fermentation conditions.'
 'The response considers the importance of linking rumen microbiome data to functional aspects of rumen fermentation.'
 'The model includes a representation of the dynamics of rumen microbial activity and substrate degradation.'
 'The model is designed to accommodate the variability in rumen microbiome and fermentation conditions.'
 'The response discusses the need for a mechanistic understanding of the relationship between rumen microbiome and rumen function.'
 'The observations include data on microbial physiology alongside rumen microbiome data.'
 'The response acknowledges the challenge of delineating the precise roles of individual phylotypes.'
 'The response considers the importance of representing the inter-relationships between different microbial classes.']","To improve the accuracy of rumen models by integrating knowledge of the rumen microbiome, we need to bridge the gap between detailed information on microbial diversity and gene expression, and the functional aspects of rumen fermentation represented in whole rumen models. 

First, we acknowledge that the rumen microbiome plays a crucial role in rumen function, and its composition varies with diet and host. However, there is a high functional redundancy and flexibility of the rumen microbial community. To link the rumen microbiome to whole rumen function, we need to observe important drivers of whole rumen function, including rumen volume, outflow, substrate degradation, VFA profiles, and fermentation conditions.

We will start by collecting data on rumen microbiome composition, gene expression, and microbial physiology alongside measurements of rumen volume, outflow, substrate degradation, VFA profiles, and fermentation conditions. This will involve standardizing rumen sampling procedures to ensure representative samples. We will also measure the impact of dietary changes on the rumen microbiome and fermentation conditions.

Next, we will develop a dynamic mechanistic model that represents the interactions between substrate degradation and microbial metabolism, as well as the inter-relationships between different functional classes of micro-organisms. The model will include representations of rumen fluid and particle dynamics, the profile of VFA produced, clearance of VFA from the rumen environment, and adaptation processes in rumen wall tissues.

The model will be designed to accommodate the variability in rumen microbiome and fermentation conditions, and will be flexible and adaptable to different dietary and physiological states. We will validate the model against independent data sets to ensure its accuracy and reliability.

To achieve this, we will follow a step-by-step approach:
1. Collect and analyze data on rumen microbiome composition, gene expression, and microbial physiology, alongside measurements of rumen volume, outflow, substrate degradation, VFA profiles, and fermentation conditions.
2. Develop a dynamic mechanistic model that represents the interactions between substrate degradation and microbial metabolism, and the inter-relationships between different functional classes of micro-organisms.
3. Include representations of rumen fluid and particle dynamics, VFA production, clearance of VFA, and adaptation processes in rumen wall tissues in the model.
4. Validate the model against independent data sets.

By following this approach, we can improve the accuracy of rumen models by integrating knowledge of the rumen microbiome, and provide a mechanistic understanding of the relationship between rumen microbiome and rumen function. This will enable us to make goal-directed use of variation in microbiome and in rumen functionality, and ultimately improve our ability to predict rumen function and make informed decisions about dietary and nutritional strategies.",4d8e8bb12955145c,5a585071fd8283a6,,,27933039
