Goal,Rubric,Reference solution,article_id,q_id,Subdomain,Category,Identifier
"You have found that referees in youth handball struggle to build a positive climate during matches, which is crucial for the educational experience of young players. Develop a training program for referees that focuses on improving their ability to create emotional ties with players, monitor their needs, and respond appropriately. Explain the key components of this program and how it addresses the identified shortcomings in referees' interactions with players.","['The program includes training on creating emotional ties with players through techniques such as physical proximity and social conversation.'
 'Referees are taught to be enthusiastic and show joy in their interactions with players, including smiling and positive affect reactions.'
 'The program emphasizes the importance of referees giving positive comments to players and using respectful and inclusive language.'
 ""Training is provided on actively monitoring players' emotional, cognitive, social, and health needs.""
 ""The program teaches referees how to respond to players' needs and solve problems effectively.""
 'The training is tailored to the specific age group of the players (9 to 12 years) and their developmental needs.'
 'The program includes practical exercises and scenarios to help referees practice the skills being taught.'
 'The training addresses the need for referees to be less focused on competition and more on the growth and enjoyment of players.'
 ""The program's effectiveness is evaluated through feedback mechanisms and potentially through further observation of referees' interactions.""
 'The training program is aligned with the broader goals of promoting positive youth development through sport and reducing dropout rates.']","The training program for referees in youth handball is designed to address the identified shortcomings in their interactions with players, particularly in building a positive climate during matches. The program is based on the understanding that referees play a critical role in creating a supportive environment for young athletes.

To develop the training program, we will first assess the current quality of referee-player interactions using the Referee-Players' Interaction Assessment Scoring System (R-PIASS) tool. This tool evaluates interactions across six dimensions: Positive Climate, Responsiveness, Behavior Management, Proficiency, Instructing, and Communicating.

The training program will focus on improving the referees' ability to create emotional ties with players, monitor their needs, and respond appropriately. The key components of the program will include:

1. **Building a Positive Climate**: Referees will be trained to create emotional ties with players through techniques such as physical proximity and social conversation. They will be encouraged to be enthusiastic and show joy in their interactions with players, including smiling and positive affect reactions. The program will also emphasize the importance of referees giving positive comments to players and using respectful and inclusive language.

2. **Responsiveness**: Referees will be taught to actively monitor players' emotional, cognitive, social, and health needs. They will learn how to respond to players' needs and solve problems effectively. This will involve training on recognizing players' emotional states and applying active listening and empathetic communication.

3. **Behavior Management**: The program will include strategies for preventing and redirecting negative behavior among players. Referees will learn how to present clear expectations for player behavior, use preventative officiating techniques, and redirect negative behavior effectively.

4. **Proficiency, Instructing, and Communicating**: Referees will be trained to organize the game smoothly and without unnecessary interruptions. They will learn how to provide clear and concise instructions, communicate their decisions effectively, and teach the rules and values of the game.

The training program will be tailored to the specific age group of the players (9 to 12 years) and their developmental needs. It will include practical exercises and scenarios to help referees practice the skills being taught. The program will emphasize the importance of referees being aware of their own shortcomings and areas for improvement.

To ensure the program is engaging and interactive, it will potentially include workshops or simulations where referees can practice their skills in a controlled environment. The training will address the need for referees to be less focused on competition and more on the growth and enjoyment of players.

The effectiveness of the training program will be evaluated through feedback mechanisms and potentially through further observation of referees' interactions using the R-PIASS tool. This will help identify areas where the program is successful and where further improvements are needed.

The training program is aligned with the broader goals of promoting positive youth development through sport and reducing dropout rates. By improving the quality of referee-player interactions, we aim to create a more supportive and enjoyable environment for young athletes, which is critical for their educational experience and overall development.

The program's development will be guided by the findings from the initial study that used the R-PIASS tool to assess the quality of referee-player interactions. The results of this study highlighted the need for improvement in building a positive climate and responsiveness, among other areas.

Overall, the training program will be a comprehensive and interactive approach to enhancing the educational role of referees in youth handball, focusing on creating a positive and supportive environment that fosters the development of young players.",4ded6ed812b00bc3,58960b257dde7b9e,,,32512779
"You are a researcher tasked with investigating the potential health benefits of various compounds found in soybeans. Your goal is to identify and explore the diverse physiological activities of these compounds and their potential roles in preventing or treating certain diseases. You have been provided with a comprehensive review of the existing literature on soybean-derived bioactive compounds, including isoflavones, phytic acid, protease inhibitors, lignans, saponins, dietary fiber, soy oligosaccharides, soy proteins, peptides, lecithin, conjugated linoleic acid (CLA), and pinitol. Develop a research plan to systematically investigate the health benefits of these compounds and their underlying mechanisms, considering the complexity of their interactions and the need to address multiple health outcomes.","['The research plan includes a clear hypothesis regarding the potential health benefits of soybean-derived bioactive compounds.'
 'The plan outlines a systematic approach to investigating the diverse physiological activities of the identified compounds.'
 'The research plan considers the complexity of interactions between different soybean-derived compounds.'
 'The plan includes a strategy for addressing multiple health outcomes associated with the consumption of soybean-derived compounds.'
 'The plan involves experimental designs to test the anticancer, anti-inflammatory, antioxidant, and antihyperglycemic effects of the compounds.'
 'The research plan considers the potential interactions between soybean-derived compounds and other dietary components.'
 'The plan includes a strategy for evaluating the bioavailability and bioaccessibility of soybean-derived compounds.'
 'The research plan involves assessing the potential synergistic or antagonistic effects among different soybean-derived compounds.'
 'The research plan includes considerations for the potential impact of processing and preparation methods on the bioactive compounds.'
 'The research plan demonstrates an understanding of the need for interdisciplinary approaches to studying the health benefits of soybean-derived compounds.']","To investigate the potential health benefits of various compounds found in soybeans, we will develop a comprehensive research plan that systematically examines the diverse physiological activities of these compounds and their potential roles in preventing or treating certain diseases.

First, we will conduct a thorough review of the existing literature on soybean-derived bioactive compounds, including isoflavones, phytic acid, protease inhibitors, lignans, saponins, dietary fiber, soy oligosaccharides, soy proteins, peptides, lecithin, conjugated linoleic acid (CLA), and pinitol. This review will provide a foundation for understanding the biochemical properties of these compounds and their potential health benefits.

Next, we will design a series of experiments to test the anticancer, anti-inflammatory, antioxidant, and antihyperglycemic effects of the identified compounds. We will use a combination of in vitro and in vivo models to assess the biological activities of these compounds. For example, we will use cell culture models to investigate the antiproliferative and pro-apoptotic effects of isoflavones and saponins on cancer cells. We will also use animal models to study the effects of soy protein and peptides on cardiovascular health and osteoporosis.

To investigate the roles of soybean-derived compounds in improving cardiovascular health, we will conduct experiments to assess their effects on lipid metabolism, blood pressure, and atherosclerosis. We will also examine the potential interactions between soybean-derived compounds and other dietary components, such as fiber and polyphenols.

To study the effects of soybean-derived compounds on preventing osteoporosis, we will conduct experiments to assess their effects on bone density, bone resorption, and osteoblast activity. We will also investigate the potential synergistic or antagonistic effects among different soybean-derived compounds.

To evaluate the bioavailability and bioaccessibility of soybean-derived compounds, we will conduct experiments to assess their absorption, distribution, metabolism, and excretion in animal models. We will also investigate the impact of processing and preparation methods on the bioactive compounds.

Throughout the research plan, we will consider the complexity of interactions between different soybean-derived compounds and their potential interactions with other dietary components. We will also evaluate the existing evidence on the health benefits of soybean-derived compounds in different populations.

To analyze the data, we will use a combination of statistical and bioinformatics tools to identify patterns and correlations between the biochemical properties of the compounds and their biological activities. We will also use machine learning algorithms to predict the potential health benefits of soybean-derived compounds based on their biochemical properties.

Overall, our research plan will provide a comprehensive understanding of the potential health benefits of soybean-derived bioactive compounds and their underlying mechanisms. By considering the complexity of interactions between different compounds and their potential interactions with other dietary components, we will be able to identify the most effective and safe ways to harness the health benefits of soybeans.

The research plan will be executed in the following steps:
1. Literature review: Conduct a comprehensive review of the existing literature on soybean-derived bioactive compounds.
2. Experimental design: Design a series of experiments to test the anticancer, anti-inflammatory, antioxidant, and antihyperglycemic effects of the identified compounds.
3. In vitro and in vivo experiments: Conduct experiments using cell culture and animal models to assess the biological activities of the compounds.
4. Data analysis: Use statistical and bioinformatics tools to analyze the data and identify patterns and correlations between the biochemical properties of the compounds and their biological activities.
5. Data interpretation: Interpret the results in the context of the existing literature and identify the potential health benefits of soybean-derived bioactive compounds.

By following this research plan, we will be able to provide a comprehensive understanding of the potential health benefits of soybean-derived bioactive compounds and their underlying mechanisms, and identify the most effective and safe ways to harness the health benefits of soybeans.",ed5ca80199ab7f87,ed7b39e7d2dc00dd,,,33920015
"You are tasked with investigating the potential of entomopathogenic fungi, such as Beauveria bassiana, to infect the red flour beetle (Tribolium castaneum) through oral ingestion. Your goal is to understand the dynamics of oral infection and how conidia distribution within the insect's alimentary canal impacts the insect's fitness and mortality. You have access to a hydrogel encapsulation method to deliver conidia to the beetles and various microscopy techniques to visualize conidia within the insect gut. However, you need to design an experiment that effectively tracks conidial movement through the alimentary canal and assesses the impact on the insect's ability to process and absorb nutrients. What research plan would you propose to achieve this goal, considering the constraints of using a non-invasive method to track conidia and the need to correlate conidia presence with mortality and nutrient absorption impairment?","['The plan involves using EGFP-tagged B. bassiana conidia to track their distribution within the alimentary canal.'
 'Confocal microscopy is proposed to visualize the presence and distribution of conidia within different regions of the alimentary canal.'
 'The plan includes dissecting the alimentary canal of both larvae and adult T. castaneum to assess conidia distribution.'
 'The plan involves quantifying conidia presence in different regions of the alimentary canal.'
 'Controls are included in the plan to account for autofluorescence and non-specific signals.'
 'The plan includes assessing the viability of conidia within the hydrogel capsules.'
 'The research plan correlates conidia presence with mortality rates in T. castaneum.'
 'The plan considers the potential impact of conidia on nutrient absorption and processing.'
 'The plan includes evaluating the absence of conidia germination within the gut.'
 'The research plan addresses the need to minimize cuticular infection during feeding.']","To investigate the potential of entomopathogenic fungi, such as Beauveria bassiana, to infect the red flour beetle (Tribolium castaneum) through oral ingestion, we propose a detailed research plan. The goal is to understand the dynamics of oral infection and how conidia distribution within the insect's alimentary canal impacts the insect's fitness and mortality.

First, we will encapsulate B. bassiana conidia within a hydrogel matrix using a mixture of 1 mL of 1% sodium alginate, 0.1 g of wheat flour, and conidia powder, with the concentration adjusted to 1 × 10^9 conidia/mL of mixture. The mixture will be extruded dropwise over a 0.2 M calcium chloride solution to form capsules, which will then be dried and stored. This method ensures a uniform distribution of conidia within the hydrogel matrix, as confirmed by confocal microscopy in the document.

To track the distribution of conidia within the alimentary canal of T. castaneum, we will use EGFP-tagged B. bassiana conidia. The EGFP-tagging will be achieved through Agrobacterium tumefaciens-mediated transformation, as described in the document. The stability and virulence of the EGFP-tagged conidia will be verified through serial passaging and virulence bioassays.

We will feed both larvae and adult T. castaneum with the conidia-encapsulated hydrogel formulation and then dissect their alimentary canals to assess conidia distribution. The alimentary canals will be imaged using confocal microscopy to visualize the presence and distribution of EGFP-tagged conidia within different regions, including the foregut, midgut, and hindgut. Controls will be included to account for autofluorescence and non-specific signals.

To quantify conidia presence, we will count the number of EGFP-tagged conidia in different regions of the alimentary canal using confocal microscopy images. This will help us understand how conidia distribution varies between larvae and adults.

We will also assess the viability of conidia within the hydrogel capsules by plating the alimentary canal contents onto Sabouraud Dextrose Yeast Extract Agar (SDYA) plates and counting colony-forming units (CFUs).

To correlate conidia presence with mortality rates, we will conduct cumulative mortality assays on T. castaneum fed with conidia-containing capsules and control capsules. The mortality data will be corrected for control mortality using Abbott's formula.

Furthermore, we will investigate the potential impact of conidia on nutrient absorption and processing by examining the overall health and fitness of the insects. This will involve monitoring the insects' feeding behavior, development, and reproduction.

To minimize cuticular infection during feeding, we will use the hydrogel encapsulation method, which has been shown to prevent conidial adhesion to the beetle's cuticle.

Finally, we will compare the efficacy of encapsulated conidia versus naked conidia powder in inducing mortality in T. castaneum. This will help us understand the advantages and limitations of the hydrogel encapsulation method.

Statistical analysis will be performed using GraphPad Prism to support the findings. The data will be analyzed to determine significant differences in conidia distribution, mortality rates, and fitness impacts between larvae and adults, as well as between encapsulated and naked conidia treatments.

By following this research plan, we aim to provide a comprehensive understanding of the dynamics of oral infection of T. castaneum by B. bassiana and the potential of using encapsulated conidia as a pest control strategy.",d1221df6396ee62a,4f444375ec3bc559,,,39997394
"A radiology department is facing an unprecedented surge in demand for COVID-19 related chest imaging during the pandemic. The department wants to optimize its staffing and resource allocation to meet this demand while minimizing the risk of disease transmission among staff and ensuring high-quality patient care. The department has access to historical data on the timing of imaging requests for COVID-19 patients, differentiated by sector of patient care (outpatients vs. in-patients). How would you analyze this data to identify patterns in demand and inform staffing decisions?","['The analysis should involve a time series analysis to understand the temporal distribution of demand for COVID-19 related chest imaging.'
 'The method should differentiate between outpatients and in-patients to account for different patterns in demand.'
 'A cosinor model should be applied to describe the diurnal distribution of requests for both outpatients and in-patients.'
 'The analysis should report the acrophase (peak time) of demand for both outpatients and in-patients.'
 'The goodness-of-fit of the cosinor model should be evaluated, and the results should be reported.'
 'The study should consider the implications of the demand patterns for staffing and resource allocation in radiology departments.'
 'The analysis should discuss potential factors influencing the observed demand patterns, such as the timing of SARS-CoV-2 testing and the role of emergency departments.'
 'The study should acknowledge the limitations of the data, including the potential for bias and the representativeness of the sample.'
 'The results should be presented in a clear and interpretable manner, using figures and tables as necessary.'
 'The implications of the study for policy and practice in radiology departments during pandemics should be clearly outlined.']","To analyze the demand for COVID-19 related chest imaging and inform staffing decisions in a radiology department, we will conduct a time series analysis of historical data on imaging requests. The analysis will differentiate between outpatients and in-patients to account for different patterns in demand.

First, we will extract the time data of requests for patients with suspected or confirmed COVID-19 lung disease from the radiological information system. We will include all chest examinations, including CT and x-ray, conducted between February 27th and May 27th, 2020. The sector of patient care will be defined by the requesting unit: emergency department (outpatients), general wards (in-patients), and intensive care units (in-patients).

Next, we will apply a multinomial logistic regression model to compare the number of requests between three time intervals (I1: 6am - 2pm, I2: 2pm - 10pm, I3: 10pm - 6am) for both outpatients and in-patients. This will help identify any significant differences in demand patterns between the two groups.

To describe the diurnal distribution of requests, we will apply a cosinor model separately for outpatients and in-patients. The cosinor model will provide the acrophase (peak time) of demand, mesor (midline statistic of rhythm), amplitude, standard error, and 95% confidence interval. We will also evaluate the goodness-of-fit of the cosinor model using the rhythm detection test and report the correlation between observed and estimated data.

To provide a negative control, we will analyze the not-COVID-19 related requests for chest imaging during the same study period and compare the demand patterns with COVID-19 related imaging. We will examine the acrophases for not-COVID-19 related imaging requests to identify any differences in demand patterns.

The results of the analysis will be used to inform staffing decisions and resource allocation in the radiology department. We will discuss the implications of the demand patterns for staffing models, including the potential need to redistribute personnel from early to late/night shifts during the first phase of a pandemic.

We will also consider potential factors influencing the observed demand patterns, such as the timing of SARS-CoV-2 testing and the role of emergency departments. The limitations of the data, including the potential for bias and the representativeness of the sample, will be acknowledged.

The study cohort will be defined based on the inclusion criteria, and the statistical methods used will be described in detail, including the software and version (R version 3.6.1). The results will be presented in a clear and interpretable manner, using figures and tables as necessary.

Finally, we will discuss the generalizability of the findings to other settings and potential future pandemic scenarios, and outline the implications of the study for policy and practice in radiology departments during pandemics.

By following this research plan, we aim to provide a comprehensive understanding of the demand for COVID-19 related chest imaging and inform evidence-based staffing decisions in radiology departments.",7e85659724ed6052,1d3a4d9ff028b402,,,33657140
